{
  "$schema": "./brief.schema.json",
  "meta": {
    "version": "0.1.0",
    "filledAt": "2026-07-28",
    "mode": "mixed",
    "assumptions": [
      {
        "field": "brand.archetype",
        "assumed": "creator",
        "why": "Не вказано клієнтом. Виведено з personality (майстерність, чесність, деталь) і з того, що компанія робить продукт власноруч.",
        "confirmed": false
      }
    ]
  },

  "company": {
    "name": "Зерно",
    "legalName": "ТОВ «Зерно Роастерс»",
    "industry": "Обсмажування спешелті-кави",
    "description": "Мікрообсмажувальня повного циклу. Купуємо зелене зерно напряму у фермерів, обсмажуємо малими партіями, продаємо власною роздрібною лінійкою і постачаємо кав'ярням.",
    "founded": 2019,
    "size": "11-50",
    "geo": ["Україна", "Польща"],
    "website": "https://example.com",
    "stage": "formalizing-existing"
  },

  "product": {
    "what": "Обсмажена спешелті-кава в зернах, 250 г і 1 кг, та оптові поставки для кав'ярень",
    "offerings": ["Роздрібна лінійка", "Оптова лінійка для HoReCa", "Обмежені мікролоти", "Підписка"],
    "priceSegment": "premium",
    "channels": ["online", "retail", "horeca", "b2b-direct"],
    "physicalProduct": true
  },

  "audience": [
    {
      "name": "Домашні ентузіасти",
      "who": "25–40 років, варять альтернативу вдома, мають ваги й гусяк, читають про походження зерна",
      "job": "Отримати вдома чашку рівня хорошої кав'ярні й розібратись у нюансах",
      "barrier": "Не довіряють обіцянкам на пачці, бояться переплатити за маркетинг",
      "trigger": "Прозорість: ферма, висота, дата обсмаження на пачці",
      "priority": "primary"
    },
    {
      "name": "Власники кав'ярень",
      "who": "Малі та середні заклади, 1–5 точок, самі стоять за баром або поруч",
      "job": "Стабільна якість зерна й передбачувані поставки без зривів",
      "barrier": "Ризик змінити постачальника і втратити смак у меню",
      "trigger": "Безкоштовне калібрування й навчання бариста",
      "priority": "primary"
    }
  ],

  "market": {
    "category": "Спешелті-кава прямих закупівель",
    "competitors": [
      { "name": "Конкурент A", "url": "https://example.com", "relation": "direct", "note": "Сильна упаковка, слабка комунікація походження" },
      { "name": "Мережеві обсмажувальні", "relation": "avoid-looking-like", "note": "Кричущі кольори, стокові фото зерен із бризками" }
    ],
    "differentiation": "Прямі контракти з конкретними фермами і дата обсмаження на кожній пачці, а не «свіжообсмажена»",
    "notLike": "Мережеві бренди з крикливою упаковкою, псевдоіталійська естетика, вінтажні вусаті бариста"
  },

  "brand": {
    "mission": "Зробити прозорість нормою в українській каві",
    "values": ["Прозорість походження", "Повага до фермера", "Технічна точність", "Без пафосу"],
    "essence": "Чесне зерно",
    "personality": ["майстровитий", "спокійний", "точний", "теплий", "неснобістський"],
    "story": "Почалося з обсмажувача на 1 кг у гаражі й одного контракту з фермою в Гватемалі"
  },

  "verbal": {
    "languages": ["uk", "en"],
    "documentLanguage": "uk",
    "tagline": "Знаємо, звідки",
    "toneAxes": { "formality": 35, "warmth": 70, "humor": 30, "expertise": 75 },
    "doSay": ["походження", "мікролот", "профіль обсмаження", "ферма", "дата обсмаження"],
    "dontSay": ["найкраща кава", "елітний", "справжній італійський", "бодрящий", "магія смаку"],
    "existingCopy": "Ця партія — з ферми Ель-Соко, 1750 м. Обсмажили 14 липня під фільтр. У чашці: чорна смородина, какао, щільне тіло."
  },

  "visual": {
    "hasLogo": true,
    "logoNotes": "Знак — стилізоване зерно, вписане в коло. Пропорції кола недоторкані.",
    "mustKeep": ["форма знака", "темно-зелений фірмовий колір", "крафтовий папір як матеріал упаковки"],
    "avoid": [
      "стокові фото з бризками кави",
      "зерна, що сиплються в повітрі",
      "вусаті бариста у підтяжках",
      "теплі помаранчеві градієнти",
      "написи рукописним шрифтом"
    ],
    "colorDirection": "Приглушена природна гама навколо наявного зеленого, без неону",
    "likes": ["японський мінімалізм в упаковці — за спокій і повітря", "етикетки з технічними даними — за чесність"],
    "dislikes": ["перевантажені етикетки", "надмірна ретро-естетика"],
    "photography": {
      "showPeople": true,
      "peopleNotes": "Реальні працівники за роботою, робочий одяг, без постановочних усмішок. Типажі, реалістичні для України та Польщі.",
      "settings": ["цех обсмаження", "лабораторія капінгу", "склад зеленого зерна", "стійка кав'ярні"],
      "mood": "Природне бокове світло, приглушений контраст, матові фактури"
    },
    "existingAssets": ["logo", "colors", "packaging"]
  },

  "references": {
    "links": [
      { "url": "https://example.com/ref1", "why": "Сітка етикетки й подача технічних даних", "aspect": "layout" },
      { "url": "https://example.com/ref2", "why": "Світло й фактура в предметній зйомці", "aspect": "photography" }
    ],
    "notes": "Референси показують рівень стриманості, а не конкретні кольори"
  },

  "scope": {
    "preset": "standard",
    "excludeSections": ["app.transport", "graphics.3d"],
    "deadline": "2026-09-15",
    "budgetLimitUsd": 40
  },

  "legal": {
    "trademarkStatus": "registered",
    "trademarkSymbol": "®",
    "fontLicenses": "Desktop-ліцензія на 5 місць, вебшрифт до 250k показів/міс",
    "restrictions": "Маркування харчового продукту згідно з вимогами до етикетки"
  }
}
